26/05/2021,"BIDEN CHIEDE RAPPORTO SULLE ORIGINI DEL VIRUS. Il presidente Usa Joe Biden chiede ai servizi segreti un rapporto definitivo sullecause del Covid 19. Raddoppiare gli sforzi per scoprire le origini del virus, afferma il capo della Casa Bianca.",0
28/05/2021, VACCINI SENZA LIMITI DI ETA’. Dal 3 giugno le regioni potranno somministrare i vaccini senza tenere conto delle classi di età. Loprevede la circolare firmata dal commissario all’emergenza Figliuolo.,10
29/05/2021,"EMA, VIA LIBERA PER PFIZER AI 12ENNI. Via libera dell’EMA alla somministrazione dei vaccini Pfizer per la fascia d’età tra i 12 e 15anni dodicenni, sono circa otto milioni gli adolescenti interessati.",10
29/05/2021,"DRAGHI: GLOBALIZZAZIONE RICETTA NECESSARIA. Global solutions summit, il premier Draghi esalta il ritorno del multilateralismoschierando la presidenza italiana del G20 in prima linea nel futuro post pandemia.",0
30/05/2021,"RIAPERTURE GRADUALI. Prima domenica senza limiti di spostamenti tra le regioni, collegamenti via mare ripristinati. Resta l’obbligodi mascherina e divieto di assembramento.",10
01/06/2021,DRAGHI: SERVE UN’ITALIA UNITA. “Quest’Italia è viva e forte”. Il presidente del Consiglio Mario Draghi in visita in Emilia Romagnaparla della ripresa economica dopo il Coronavirus e rilancia sull'unità.,10
02/06/2021,"VACCINI, CADE IL CRITERIO DELLE FASCE DI ETA’. Campagna vaccinale, dal 3 giugno le prenotazioni saranno aperte a tutti. Sulfronte dei numeri della pandemia resta stabile il tasso di positività, in discesa il numero dei ricoveri.",10
03/06/2021,"RIAPERTURE IN ZONA BIANCA. Riaperture in zona bianca, Governo e Regioni raggiungono l’accordo sui ristoranti: nessun limiteall’aperto mentre al chiuso non permessi oltre sei commensali al tavolo.",10
05/06/2021,"L’ULTIMO TRAGUARDO DELLA CAMPAGNA VACCINALE. In Italia il virus frena ancora mentre si afferma un nuovo record per lacampagna vaccinale. Grande successo di adesioni tra i giovani. Speranza: ""Continuiamo così, è la strada giusta.""",10
07/06/2021,DA OGGI COPRIFUOCO A MEZZANOTTE. Cambiano di nuovo le regole per arginare la minaccia del virus: da oggi nelle zone gialleil coprifuoco slitta alla mezzanotte. Il numero dei nuovi contagi mai così basso da settembre.,10
08/06/2021,VISITA DI MATTARELLA A MILANO. “È bene mantenere alta l’attenzione” dice il presidente Mattarella in visita a Milano perl’inaugurazione dell’anno accademico. Il capo dello Stato invita alla prudenza nella lotta al Covid.,0
09/06/2021,"VACCINI IN VACANZA, SI PUO’. “Via libera al vaccino in vacanza ma solo in casi eccezionali” dice il commissario Figliuolo chesottolinea come il Paese sia pronto anche per il green pass a cui il Parlamento europeo ha dato il via libera.",10
10/06/2021,"ASTRAZENECA, USO RACCOMANDATO PER OVER 60. Emergenza virus: all'esame del Comitato tecnico-scientifico lasomministrazione del vaccino AstraZeneca per i giovani. Il parere del ministero: uso preferenziato per over 60.",0
11/06/2021, STOP ASTRAZENECA AI GIOVANI. Il Cts decide di bloccare la somministrazione di AstraZeneca per gli under 60. A coloro chehanno ricevuto la prima dose sarà somministrato il richiamo con vaccino Pfizer o Moderna.,0
12/06/2021,"LA REVISIONE DEL PIANO VACCINALE. Dopo la decisione di sospendere Astrazeneca per gli under 60, il piano vaccinale subisceuna nuova revisione per l’attuazione delle nuove regole. Figliuolo: la sostenibilità logistica c’è.",10
12/06/2021,DODICI REGIONI IN ZONA BIANCA. Quaranta milioni di italiani e dodici regioni saranno presto in zona bianca: cadono le restrizionima non le precauzioni. Attesa per l’introduzione del green pass.,10
15/06/2021,"REGNO UNITO ALLE PRESE CON LA VARIANTE DELTA. In Regno Unito è allarme variante Delta ma uno studio dell’istituto sanitarionazionale rassicura sull’efficacia del vaccino Astrazeneca al 92%, a patto di ricevere entrambe le dosi.",10
15/06/2021,MENO PRESSIONE SUGLI OSPEDALI. In Italia i nuovi casi di Covid risalgono sopra quota mille ma cala la pressione sulle struttureospedaliere e il numero di terapie intensive.,10
16/06/2021,"TERAPIE INTENSIVE AL MINIMO. Sempre più in decrescita i numeri dell’epidemia in Italia ma soprattutto si svuotano le terapieintensive. La campagna vaccinale, intanto, prosegue a ritmi serrati.",10
17/06/2021," DRAGHI VARA IL GREEN PASS. Il premier Draghi firma il decreto per il green pass, il certificato vaccinale che potrà consentire dispostarsi liberamente per lavoro, studio, turismo in Italia e negli Stati dell’Unione europea.",10
17/06/2021,"DELTA, PICCO CONTAGI IN GB. In Gran Bretagna picco di contagi a causa della variante Delta. Prosegue intanto il piano diimmunizzazione sul mix di vaccini: secondo EMA la strategia può essere applicata.",0
18/06/2021," DRAGHI: L’ETEROLOGA FUNZIONA. Monito del premier Draghi sull’efficacia dei vaccini: l’eterologa funziona, anch’io la farò -ammonisce il presidente del Consiglio ribadendo la posizione del Governo.",10
18/06/2021,LA CURVA DEI CONTAGI. Oltre quindici milioni e mezzo di italiani immunizzati su 44 milioni di somministrazioni. La campagnavaccinale continua a correre ma Figliuolo precisa: mancano oltre due milioni di over 60.,10
19/06/2021, IL GOVERNO ATTENDE IL CTS. Sul superamento dell’obbligo di mascherina all’aperto il Governo attende il parere del Cts. Sullanecessità dei vaccini resta l’appello del premier Draghi che rassicura sull’efficacia.,10
19/06/2021,LEGA IN PIAZZA A ROMA. “Stiamo lavorando per la ripartenza del Paese” ribadisce il leader Matteo Salvini con la Lega chescende in piazza a Roma rivendicando l’allentamento delle misure anti Covid.,0
19/06/2021,IL DIBATTITO POLITICO. Tra i temi del confronto politico restano accesi i temi più cruciali: l'uso dei fondi europei per la ripresa e lostop all'obbligo di mascherine all'aperto. Il Pd in attesa delle primarie.,0
21/06/2021,"ITALIA IN ZONA BIANCA. Da oggi tutta Italia è in zona bianca, salvo la Valle d’Aosta. Contagi e decessi in netta diminuzione; lacampagna vaccinale procede seguendo ritmi serrati.",10
22/06/2021,"DA 28 GIUGNO ALL’APERTO SENZA MASCHERINA. Dal lunedì 28 giugno via le mascherine all’aperto in zona bianca. Resta l’obbligodi indossarle nei luoghi di possibile affollamento, negli ospedali e mezzi di trasporto.",10
25/06/2021,"DRAGHI: LA PANDEMIA NON È FINITA. Mario Draghi in conferenza stampa dopo il Consiglio Ue a Bruxelles parla di migranti edemergenza sanitaria: “La pandemia non è finita, non se siamo ancora fuori"".",-10
25/06/2021,"VAL D'AOSTA IN ZONA BIANCA. Il ministro della Salute Roberto Speranza firma l'ultima ordinanza che sancisce il passaggio del'ultima Regione, la Valle d'Aosta, in zona bianca.",10
26/06/2021,"LA MINACCIA DELTA. Resta alta l’attenzione verso la variante Delta che a fine estate rischia di diventare dominante anche inItalia. I casi legati alla ex ""indiana"" sono passati dal 4,2% di maggio al 16,8% di giugno.",-10
28/06/2021,ALL’APERTO SENZA MASCHERINA. Cade l'obbligo di mascherina nei luoghi all’aperto: l’Italia si appresta ad allentare le restrizioni suldispositivo da subito diventato uno dei simboli della pandemia.,10
28/06/2021,IPOTESI GREEN PASS SOLO CON SECONDA DOSE. La certificazione verde potrà essere rimodulata. Lo annuncia il sottosegretarioalla Salute Sileri che ipotizza il rilascio del green pass europeo solo quindici giorni dopo la seconda dose.,10
01/07/2021,DA OGGI IL GREEN PASS EUROPEO. Il green pass europeo è operativo. Permetterà di varcare i confini nazionali a coloro che sonoin possesso dei requisiti: chi ha completato il ciclo vaccinale o chi abbia un tampone negativo.,10
03/07/2021,"GREEN PASS FALSI, È ALLARME. Vaccini e green pass falsi venduti nelle maglie del dark web: la scoperta ad opera di una indaginedella Guardia di finanza. Sequestrati dieci canali Telegram.",-10
03/07/2021,ALLERTA VARIANTI. L’Italia resta in fascia bianca: i contagi sono sotto controllo così come la situazione negli ospedali. Tuttavia gliesperti ammoniscono: Delta presente in sedici regioni.,-10
06/07/2021,"PRESSING SUGLI INSEGNANTI. Si accende il dibattito sul ritorno a scuola in DaD oppure in presenza. Il generale Figliuolo confermache gran parte del personale scolastico, circa 200mila, deve ancora vaccinarsi.",-10
06/07/2021,"COVID, MASSIMA ALLERTA. Poco più di 900 i casi da contagio di Coronavirus in Italia. Obiettivo è continuare il tracciamento,ammonisce l’ISS: preoccupa la risalita dei contagi in altri Paesi europei.",-10
09/07/2021,LA VARIANTE DELTA SI FA STRADA. Torna a salire la curva dei contagi mentre sale la preoccupazione per la variante Delta. Leraccomandazioni dell’ISS: in vista del rientro a scuola decisivo il percorso vaccinale completo.,-10
11/07/2021," LA CURVA RISALE. La variante Delta si diffonde rapidamente nel Paese, soprattutto tra i giovani. Sono quasi 1400 i nuovi contagi inItalia. Da nord a sud rafforzati i controlli per evitare gli assembramenti.",-10
13/07/2021,"GREEN PASS, I PARTITI SI DIVIDONO. L’ipotesi del green pass obbligatorio per locali e trasporti accende la discussione politica. Pdpossibilista, scettici i 5 Stelle, reazioni diverse tra i governatori, no di Fratelli d’Italia.",0
16/07/2021," DELTA CORRE, BALZO DEI CONTAGI. Continua a crescere la curva dei contagi: il numero dei casi positivi pari a quasi tremila.Aumentano anche le terapie intensive e il tasso di positività. Cinque regioni rischiano la zona gialla.",-10
16/07/2021,"GREEN PASS, VERSO UN NUOVO DECRETO. Il Governo studia le modifiche al green pass: in arrivo un decreto da estendere adaerei, treni, eventi e concerti. Si discute sull’utilizzo nelle scuole e nei bar e ristoranti.",-10
18/07/2021," GREEN PASS, AFFONDO DI SALVINI. Il leader della Lega Matteo Salvini all’attacco contro il green pass e le vaccinazioni ai giovani.Alle critiche del Pd si associano anche Italia Viva e Leu.",0
20/07/2021," PRESIDI: Sĺ OBBLIGO VACCINALE. Fa discutere l’ipotesi dell’obbligatorietà del vaccino tra gli operatori scolastici, conditio sine quanon dell’apertura delle scuole in sicurezza. I presidi: obbligo necessario.",0
20/07/2021,"LICENZIAMENTI, PROTESTE E SCIOPERI. Nuove proteste contro la chiusura delle fabbriche: scioperi negli stabilimenti della Brianzacontro i licenziamenti. A Napoli operai Whirpool bloccano per alcune ore i binari della stazione.",0
21/07/2021,"GREEN PASS, VERSO IL NUOVO DECRETO. Ipotesi green pass anche al ristorante e al chiuso. Mentre i contagi risalgono, crescel’attesa per il nuovo decreto anti Covid: sul tavolo del governo i nuovi parametri da applicare.",-10
22/07/2021, LE NUOVE MISURE DEL GOVERNO. Il Consiglio dei ministri delibera la proroga dello stato di emergenza nazionale fino al 31dicembre e decide le modalità di utilizzo del green pass con nuovi criteri per i colori delle Regioni.,-10
22/07/2021,"APPELLO DI DRAGHI. “L’appello a non vaccinarsi è un appello a morire”. È netto l’appello del presidente del Consiglio cherisponde così, in conferenza stampa, ai richiami alla libertà per i vaccini under 40.",0
23/07/2021," NUOVE REGOLE DAL 6 AGOSTO. Dal 6 agosto scatterà l’obbligo di certificazione per accedere nei ristoranti, nei bar al chiuso e peri grandi eventi. Entrano in vigore anche i nuovi parametri per i cambi di colore delle Regioni.",0
24/07/2021," VACCINI, BOOM DI PRENOTAZIONI. Boom di prenotazione dei vaccini dopo le parole del premier Draghi. Per il generale Figliuolo sitratta di un successo distribuito su tutte le regioni.",10
24/07/2021,"GREEN PASS E GIUSTIZIA, QUERELLE IN MAGGIORANZA. Resta alta la tensione nella maggioranza, sia sulla applicazione del greenpass sia per la questione giustizia. Il premier Draghi congela la trattativa in atto.",0
25/07/2021," LA CORSA DELLA CAMPAGNA VACCINALE. Mentre il generale Figliuolo rassicura sull’arrivo regolare delle dosi, la campagnavaccinale supera 65 milioni di somministrazioni. Prosegue intanto l’incremento di ricoveri e nuovi focolai.",10
25/07/2021,"GREEN PASS, CRITICHE DALLA LEGA. La piazza va ascoltata. Il leader della Lega Matteo Salvini annuncia che presenterà propostedi modifica al decreto relativo al green pass obbligatorio.",0
26/07/2021,"GREEN PASS FALSI, È ALLARME. L’utilizzo di green pass falsi rischia di diffondersi. Palazzo Chigi, rilanciando l’app gratuita creata perverificare l’autenticità del documento, mette in guardia.",0
27/07/2021," VERSO IL NUOVO ANNO SCOLASTICO. In vista del nuovo anno scolastico, il Governo si appresta a presentare alle Regioni le misuredel nuovo piano: obiettivo è la didattica in presenza, possibile obbligo vaccinale per il personale.",0
28/07/2021,"IN ATTESA DEL DECRETO. Slitta il decreto per l’estensione del green pass. Si discute sulla necessità dell’obbligatorietà per ilpersonale scolastico e per viaggiare su treni, navi e aerei.",0
28/07/2021,"MODERNA, VIA LIBERA AIFA PER I GIOVANISSIMI. Via libera dell’AIFA al vaccino Moderna per la fascia di età dai 12 ai 17 anni.Palazzo Chigi annuncia l’arrivo di un milione di dosi Pfizer in più ad agosto.",0
29/07/2021,"NO GREEN PASS, LEGHISTI IN PIAZZA. La presenza di alcuni parlamentari leghisti alla manifestazione organizzata a Roma dai 'nogreen pass' accende la polemica tra i partiti. La Lega prende le distanze.",0
31/07/2021," IN PIAZZA IL POPOLO DEL NO GREEN PASS. Il tam tam della rete mobilita il popolo no green pass. Migliaia di persone in piazza innumerose città per protestare contro la certificazione verde, obbligatoria dal 6 agosto per diverse attività.",0
31/07/2021,"RICOVERI IN AUMENTO. In aumento le terapie intensive e i ricoveri da Covid, registrati nuovi focolai nei luoghi di vacanza. L’ISSconferma: i festeggiamenti per gli Europei hanno incentivato i contagi tra i giovani.",-10
01/08/2021,IMMUNIZZATO IL 60%. L’obiettivo prefissato dal generale Figliuolo per fine luglio è raggiunto: immunizzato il 60% della popolazioneover 12. Allo studio la necessità della terza dose di vaccino per i soggetti più fragili.,10
02/08/2021,"VACCINATI 6 ITALIANI SU 10. Sei italiani su dieci hanno completato il percorso vaccinale contro Coronavirus. Lo annuncia ilministro della Salute Speranza: ""È un primo importante risultato, proseguire su questa strada"".",10
03/08/2021,"GREEN PASS, GOVERNO AL LAVORO. Il Governo al lavoro per decidere l’estensione delle nuove norme anche a trasporti, scuola edimprese. Apertura da parte dei sindacati che però avvisano: non sia strumento per licenziare.",0
04/08/2021,"GREEN PASS E PIANO SCUOLA AL VAGLIO DEL GOVERNO. Le nuove misure anti Covid al vaglio del Governo, dai parametri delgreen pass al piano scuola. A settembre priorità al ritorno in classe in presenza e in sicurezza.",10
05/08/2021,"GREEN PASS AL CENTRO DELLA SCENA POLITICA. In previsione della cabina di regia, Matteo Salvini tiene il punto sul certificatoverde: no a multe e restrizioni, sì al buon senso. I criteri di applicazione del green pass restano al centro del dibattito.",0
06/08/2021,GREEN PASS DA OGGI IN VIGORE. Entrano in vigore da oggi i divieti d'ingresso nei luoghi al chiuso e in quelli all'aperto conassembramenti senza certificato verde. Salvini chiede di rivedere il provvedimento già a fine agosto.,0
07/08/2021,"VACCINI, BOOM TRA GLI UNDER 19. Mentre il numero dei contagi resta stabile, la campagna vaccinale corre: è boom di adesioni tra igiovanissimi ma campanello d’allarme tra gli over 50: oltre 4 milioni sono scoperti.",10
07/08/2021,"IL GREEN PASS DIVIDE LE FORZE POLITICHE. Gli obblighi del green pass restano al centro del dibattito politico tra partiti dimaggioranza e opposizione. Duro la critica di FdI: italiani con restrizioni, migranti senza obbligo di vaccino.",0
08/08/2021,"VACCINI, ENTRO SETTEMBRE IL 70% IMMUNIZZATO. Mentre è record per il green pass, entro settembre assicura l’AIFA, saràvaccinato il 70% degli italiani. In queste settimane sono i giovani a trainare la campagna vaccinale.",10
09/08/2021,IL GREEN PASS AGITA LA MAGGIORANZA. Obbligo di green pass e reddito di cittadinanza agitano la maggioranza. Pressing delleforze politiche che sostengono il Governo per apportare modifiche alle due misure.,0
09/08/2021,RISCHIO ZONA GIALLA. L'ISS conferma tutte le regioni in zona bianca ma a rischiare di più sono Sardegna e Sicilia: il tasso dioccupazione di posti letto in area medica e in terapia intensiva resta vicino alla soglia limite.,-10
10/08/2021,"PREOCCUPA IL RIENTRO A SCUOLA. Preoccupa il ritorno a scuola a settembre. Dal 16 agosto confermate intanto le vaccinazioni senzaprenotazione per i 12-18enni, annuncia il generale Figliuolo.",0
10/08/2021,"GREEN PASS PER SCONGIURARE CHIUSURE. Green pass, il Governo conferma l’intenzione di seguire la linea del rigore per evitarenuovi lockdown in autunno. L’uso della certificazione sarà estesa a scuole e università dal 1° settembre.",10
11/08/2021,IN AUTUNNO VACCINO AI PIU PICCOLI. È atteso per il mese di novembre il via libera al vaccino in età pediatrica. Lo haannunciato il Comitato tecnico scientifico in seguito al numero crescente di bimbi colpiti dal virus.,10
12/08/2021,OLTRE SETTEMILA NUOVI CASI. Oltre settemila casi e trenta decessi. Si attesta in sensibile aumento il numero dei nuovi casi legati alcontagio da Covid e all’intensificarsi delle terapie intensive.,-10
16/08/2021,OBBLIGO DI GREEN PASS NELLE MENSE AZIENDALI. Palazzo Chigi chiarisce: per pranzare sul luogo di lavoro è necessario il greenpass. I lavoratori potranno accedere al tavolo delle mense aziendali solo se in possesso di certificazione verde.,0
18/08/2021,SICILIA IN AREA CRITICA. Si complica la situazione in Sicilia in seguito all'aumento delle terapie intensive e all'occupazione deireparti. L'isola tocca il 10% soglia massima prevista dai nuovi parametri.,-10
20/08/2021,"MATTARELLA APRE IL MEETING DI CL. Il presidente Mattarella apre il Meeting di Comunione e Liberazione e lancia un appello allacomunità solidale dell'Europa. Poi sull'emergenza pandemia, il richiamo: vaccinarsi è un dovere.",0
21/08/2021,LE CRITICHE DI BONOMI. Al Meeting di Rimini il presidente di Confindustria Bonomi critica il rifiuto dei confederali di non sedersi a untavolo per aggiornare i protocolli di sicurezza nelle aziende introducendo il green pass.,0
22/08/2021,LA SCUOLA VERSO LE NUOVE NORME. Il personale scolastico privo di green pass sarà sospeso. La conferma sulla norma giàprevista dalla legge arriva dal ministro dell’Istruzione Bianchi al meeting di Rimini.,0
23/08/2021,"IL DIBATTITO SULL'OBBLIGO VACCINALE. Mentre proseguono a ritmo serrato le vaccinazioni agli adolescenti, gli esperti delcomitato di bioetica rilanciano sull' obbligo vaccinale.",0
28/08/2021,I NO GREEN PASS TORNANO IN PIAZZA. Il popolo dei 'no green pass' torna in piazza nelle principali città italiane. In centinaiaprotestano contro una emergenza definita dittatura sanitaria. Momenti di tensione a Torino e Roma.,0
31/08/2021,"NO GREEN PASS, STAZIONI BLINDATE. Controlli e presidi rafforzati nelle principali stazioni in vista delle proteste no pass inconcomitanza con l'entrata in vigore dell'obbligo di green pass per scuole, bus, treni, aerei.",0
01/09/2021,"GREEN PASS, DA OGGI NUOVE REGOLE. Primo giorno per il certificato verde, obbligatorio su aerei, treni, navi a lunga percorrenza.Anche nelle scuole e università sarà indispensabile essere in possesso del green pass.",0
01/09/2021,"NO PASS, PROTESTE FALLITE. Stazioni blindate contro i no vax, che avevano minacciano di bloccarle contro l'obbligo di certificatoverde per i trasporti. Ma alla protesta in 54 città aderiscono pochi partecipanti.",0
02/09/2021,"LA ROTTA DI DRAGHI. Al termine del Consiglio dei ministri conferenza stampa del premier Mario Draghi. L'orientamento delGoverno, che non esclude l'obbligo vaccinale, è quello di estendere l'utilizzo del green pass.",0
03/09/2021,OVER 50ENNI IN RITARDO. In Italia 71% di immunizzati ma sono oltre tre milioni e mezzo gli over 50enni che non hanno ricevuto ilvaccino. Speranza: valutiamo scelte che possano portare a obbligo vaccinale.,-10
06/09/2021,"DECRETO GREEN PASS ALLA CAMERA. Approda alla Camera il decreto legge sull'emergenza Covid: oltre alla definizione dellemisure più urgenti, il testo prevede anche la proroga della validità da 9 a 12 mesi.",0
06/09/2021,CONFRONTO CON I SINDACATI. Il Governo è pronto a procedere con l'estensione massima dei criteri del green pass rivolto aidipendenti pubblici e poi alle aziende. Incontro tra imprese e sindacati.,0
07/09/2021,"GREEN PASS IN ESAME. Dopo gli scontri dei giorni passati, arriva il dietrofront. I partiti della maggioranza, compresa la Lega, ritiranogli emendamenti al decreto green pass in esame alla Camera.",0
08/09/2021,"GREEN PASS, TENSIONE IN AULA. Decreto green pass, resta alta la tensione alla Camera. In difformità con la maggioranza, la Legavota gli emendamenti con l’opposizione scatenando dure reazioni da parte di Pd e 5 Stelle.",0
09/09/2021,NUOVE REGOLE. Il Consiglio dei ministri vara il decreto che estende l’utilizzo del green pass al personale della scuola e a chi operanelle Rsa. Il premier Draghi annuncia ulteriori estensioni del certificato.,0
09/09/2021,"AIFA, VIA LIBERA ALLA TERZA DOSE. Precedendo il parere dell’’Ema, l’Agenzia italiana del farmaco concede il via libera alla terzadose di vaccini anti Covid per le fasce più fragili, immunodepressi e anziani.",10
10/09/2021,"COVID, IN CALO L’INDICE RT. Covid, ancora in calo l’indice Rt. L’Italia resta in zona bianca tranne la Sicilia. Diminuiscono le regionia rischio moderato. Il commissario Figliuolo: pronti per la terza dose.",10
10/09/2021,"GREEN PASS E NUOVE ESTENSIONI. Green pass, previsto obbligo a scuola anche per i genitori che faranno ingresso negli istituti. Iltimore dei presidi che avvertono per il rischio assembramenti.",0
12/09/2021,"GREEN PASS, MELONI ATTACCA. Il ministro Lamorgese conferma l’intenzione dell’esecutivo di estendere il green pass e richiama illeader della Lega alla coesione. FdI con Meloni attacca: sì alla campagna vaccinale, no a questo green pass.",0
14/09/2021, IL RICHIAMO DI DRAGHI. Le cose vanno fatte perché si devono fare. Il premier Draghi lancia un richiamo alla politica sullacampagna vaccinale per vincere le varianti. Atteso il decreto green pass con misure anche per aziende private.,0
15/09/2021,INCONTRO CON I SINDACATI. Incontro tra il premier Draghi e i sindacati sulle modalità di estensione del green pass a tutti i settorilavorativi. Obiettivo del Governo è rendere obbligatorio il certificato anche nel privato.,0
16/09/2021," GREEN PASS, VIA LIBERA DEL CDM. Il Consiglio dei ministri approva il decreto legge che dal 15 ottobre rende obbligatorio il greenpass nei luoghi di lavoro pubblici e privati. Previsti prezzi calmierati per i tamponi.",0
18/09/2021," VACCINI, EFFETTO GREEN PASS. Effetto dirompente della certificazione verde sulla campagna vaccinale. Dopo una fase di stallonuova impennata in numerose regioni italiane ma preoccupano gli oltre 3,4 milioni che mancano all'appello.",10
18/09/2021,IL DIBATTITO POLITICO. La questione green pass resta in primo piano nel dibattito politico. Letta plaude Draghi e critica confermezza Salvini e Meloni. Il centro destra accusa Pd e % Stelle di voler aumentare le tasse.,0
19/09/2021, CORSA AL VACCINO. Vaccinati tre quarti della popolazione. Le nuove regole sul green pass producono una accelerazione nellacampagna vaccinale - fino al 40% in più - come sottolineato dal commissario Figliuolo.,10
19/09/2021,"LETTA VS SALVINI. Mentre il ministro Giorgetti difende il green pass, il leader leghista Matteo Salvini conferma perplessitàsull'estensione del certificato ed Enrico Letta lo attacca: è di fatto all'opposizione.",0
20/09/2021," TERZA DOSE AL VIA. Al via in Italia le somministrazioni della terza dose del vaccino anti Covid. Primi a beneficiarne i soggetti arischio, complessivamente circa tre milioni, ma la platea delle categorie vaccinabili potrebbe essere estesa.",10
22/09/2021," MATTARELLA FIRMA IL DECRETO. Il testo finale del nuovo decreto Green pass firmato dal presidente Mattarella: blocco dellostipendio ma nessun provvedimento disciplinare per i lavoratori senza Green pass, pubblici o privati.",0
22/09/2021,COLLOQUIO DRAGHI-PUTIN. Sulla lotta alla pandemia sì ad una maggiore collaborazione internazionale. Colloquio telefonico tra ilpremier Draghi e il presidente Putin sul G20 di Roma di fine ottobre e sulla situazione in Afghanistan.,0
24/09/2021,PA. DAL 15/10 RIENTRO IN PRESENZA. Il premier Mario Draghi fIrma il Dpcm per il ritorno in presenza dei dipendenti della P.A. Ilministro Brunetta annuncia le trattative che garantiranno l'attesa regolazione dello smart working.,10
25/09/2021,"I NO GREEN PASS IN PIAZZA. Con cartelli e slogan 'no alla dittatura sanitaria' il popolo dei no green pass torna a manifestare innumerose piazze: migliaia di persone nella capitale, tensioni in piazza Fontana a Milano.",10
25/09/2021,"VACCINI, 45 MILIONI DI DOSI AI PAESI POVERI. L'Italia metterà a disposizione 45 milioni di dosi di vaccino per i Paesi che ne hannobisogno"". Lo annuncia il ministro Di Maio al termine della settimana a New York per l'assemblea generale dell'Onu.",10
26/09/2021,"CONTAGI IN DISCESA. Quasi il 20% in meno di casi positivi in una settimana: la curva dei contagi si presenta ancora in calo. Dopoover 80 e ospiti delle Rsa, sì del Cts alla terza dose per medici e infermieri.",10
28/09/2021,NADEF SUL TAVOLO DEL GOVERNO. Al Consiglio dei ministri attese le stime sui conti pubblici che decretano la ripresa dopo la crisiesplosa con la pandemia. La nota di aggiornamento al Documento di economia e finanza è in dirittura d’arrivo.,0
